title,code,category
2024京东方全球创新伙伴大会隆重举行,C000008,财经
“一个西方关键盟友要倒向俄罗斯”,C000014,体育
“巨无霸”来了！两家千亿市值巨头宣布将合并：中国船舶拟吸收合并中国重工,C000024,军事
“怎么这么大官威啊？”女教授节目中怒怼官员！称“没有彩排”,C000010,IT
中国对加拿大采取反制措施，释放哪些信号？,C000013,健康
中国海警正告菲方：立即撤走9701号船，否则后果自负！国防部也发声,C000023,文化
中国美院：教师赵某某涉嫌违法犯罪，警方对其立案调查,C000010,IT
中国近年来规模最大主场外交即将举行！一图了解→,C000013,健康
习近平和彭丽媛为出席中非合作论坛北京峰会的国际贵宾举行欢迎宴会,C000024,军事
五部门：在广州、成都、深圳等8个城市各设立1家市内免税店,C000022,招聘
俄罗斯高超导弹专家希普尤克因叛国罪被判15年,C000008,财经
女子报警称被高校教师强奸，杭州警方通报：嫌犯被刑拘,C000022,招聘
对话遭逆行女司机殴打者：我忍了又忍，仍头晕恶心,C000020,教育
揪心！四川一女子坠河失踪！是当地网红，家中有两个孩子，仍在搜救,C000010,IT
杭州警方通报网红“铁头”被抓详情,C000010,IT
瑞典名帅埃里克森去世：曾在中国执教5年，险些成为国足主帅,C000014,体育
真是给你脸了，奥运冠军陈艺文回怼造谣者,C000010,IT
突然崩了！国际油价暴跌，美股跳水，英伟达市值蒸发1.5万亿元！发生了什么？,C000013,健康
突然！乌克兰，重大宣布！,C000024,军事
美司令宣称可为菲舰艇“护航”，中方：美国不得支持纵容菲律宾采取侵权行为,C000024,军事
菲海警：因被40艘中国船管控 仙宾礁补给再次失败,C000014,体育
这个大国领导人又去夜店热舞，37岁当外婆果然“活力四射”,C000014,体育
逆行打人女司机身份确认，更多细节披露，被殴打男子称不考虑和解,C000013,健康
郑钦文美网比赛现场有观众骂脏话 她霸气回怼,C000014,体育
马上迎来5周调休！网友：看花眼！,C000022,招聘
